{
  "schema_version": 2,
  "revision": "catalogue-api-ia-2026-09-05.3",
  "generated_at": "2026-09-05T00:00:00+02:00",
  "source": {
    "label": "catalogue_modeles_IA_API_2026.txt",
    "sha256": "179dabf94c731541e929fe57845fedff79f249af058f483fcc4146d9c8b0d62e",
    "updated_on": "2026-09-05",
    "entry_count": 59,
    "priced_entry_count": 49,
    "variable_entry_count": 10,
    "provider_label_count": 21,
    "scope": "API/cloud text, reasoning and code models; no image, video, audio, 3D or local-only models"
  },
  "normalization": {
    "card_count": 58,
    "priced_card_count": 48,
    "quarantined_family_count": 11,
    "operations": [
      {
        "kind": "merge_price_schedules",
        "source_lines": [
          59,
          119
        ],
        "card_id": "deepseek-v4-flash"
      },
      {
        "kind": "merge_price_schedules",
        "source_lines": [
          144,
          205
        ],
        "card_id": "deepseek-v4-pro"
      },
      {
        "kind": "split_models",
        "source_lines": [
          124
        ],
        "card_ids": [
          "cohere-aya-expanse-8b",
          "cohere-aya-expanse-32b"
        ]
      },
      {
        "kind": "quarantine_external_retirement",
        "source_lines": [],
        "card_id": "cohere-aya-expanse-8b",
        "note": "External status only: Cohere retirement effective 2026-04-04 is documented by the separately verified Cohere deprecations source in provider-integrations.v1.json; the TXT price remains historical catalogue data"
      },
      {
        "kind": "sort_correction",
        "source_lines": [
          99,
          104
        ],
        "note": "Qwen3-Coder-Next $6.00 precedes Qwen 3.6 Plus $6.06"
      }
    ]
  },
  "comparison_profile": {
    "id": "monthly-reference-v1",
    "calls": 1000,
    "input_tokens_per_call": 10000,
    "output_tokens_per_call": 2000,
    "input_tokens_total": 10000000,
    "output_tokens_total": 2000000,
    "cache_hit_percent": 0,
    "batch": false,
    "currency": "USD",
    "taxes_included": false,
    "price_policy": "highest_reference_cost_across_all_schedules",
    "note": "Per-call sizes are fixed so context-dependent price tiers are comparable; the highest applicable schedule is the conservative default and every variant remains visible."
  },
  "capability_dimensions": [
    "general",
    "reasoning",
    "code",
    "math",
    "research",
    "tools",
    "agentic",
    "instructions",
    "reliability",
    "factuality",
    "speed",
    "multilingual"
  ],
  "capability_profiles": {
    "utility_flash": {
      "general": 6,
      "reasoning": 4,
      "code": 5,
      "math": 4,
      "research": 4,
      "tools": 6,
      "agentic": 6,
      "instructions": 6,
      "reliability": 6,
      "factuality": 5,
      "speed": 10,
      "multilingual": 7
    },
    "balanced_economy": {
      "general": 7,
      "reasoning": 6,
      "code": 6,
      "math": 6,
      "research": 5,
      "tools": 7,
      "agentic": 7,
      "instructions": 7,
      "reliability": 7,
      "factuality": 6,
      "speed": 8,
      "multilingual": 7
    },
    "reasoning_economy": {
      "general": 7,
      "reasoning": 8,
      "code": 7,
      "math": 8,
      "research": 6,
      "tools": 7,
      "agentic": 7,
      "instructions": 7,
      "reliability": 7,
      "factuality": 7,
      "speed": 6,
      "multilingual": 7
    },
    "coder_economy": {
      "general": 6,
      "reasoning": 7,
      "code": 9,
      "math": 7,
      "research": 5,
      "tools": 8,
      "agentic": 8,
      "instructions": 8,
      "reliability": 7,
      "factuality": 6,
      "speed": 7,
      "multilingual": 6
    },
    "agentic_economy": {
      "general": 7,
      "reasoning": 7,
      "code": 7,
      "math": 6,
      "research": 7,
      "tools": 9,
      "agentic": 9,
      "instructions": 8,
      "reliability": 7,
      "factuality": 7,
      "speed": 7,
      "multilingual": 7
    },
    "multilingual": {
      "general": 7,
      "reasoning": 6,
      "code": 5,
      "math": 5,
      "research": 6,
      "tools": 6,
      "agentic": 5,
      "instructions": 7,
      "reliability": 7,
      "factuality": 7,
      "speed": 7,
      "multilingual": 10
    },
    "advanced_general": {
      "general": 9,
      "reasoning": 8,
      "code": 8,
      "math": 8,
      "research": 8,
      "tools": 8,
      "agentic": 8,
      "instructions": 9,
      "reliability": 8,
      "factuality": 8,
      "speed": 6,
      "multilingual": 8
    },
    "advanced_reasoning": {
      "general": 8,
      "reasoning": 9,
      "code": 8,
      "math": 9,
      "research": 8,
      "tools": 8,
      "agentic": 8,
      "instructions": 9,
      "reliability": 8,
      "factuality": 8,
      "speed": 5,
      "multilingual": 8
    },
    "advanced_coder": {
      "general": 8,
      "reasoning": 9,
      "code": 10,
      "math": 8,
      "research": 7,
      "tools": 9,
      "agentic": 10,
      "instructions": 9,
      "reliability": 8,
      "factuality": 7,
      "speed": 5,
      "multilingual": 7
    },
    "enterprise_rag": {
      "general": 8,
      "reasoning": 8,
      "code": 7,
      "math": 7,
      "research": 9,
      "tools": 9,
      "agentic": 9,
      "instructions": 9,
      "reliability": 9,
      "factuality": 9,
      "speed": 6,
      "multilingual": 9
    },
    "premium_frontier": {
      "general": 10,
      "reasoning": 10,
      "code": 9,
      "math": 9,
      "research": 9,
      "tools": 9,
      "agentic": 9,
      "instructions": 10,
      "reliability": 9,
      "factuality": 9,
      "speed": 4,
      "multilingual": 9
    },
    "exceptional": {
      "general": 10,
      "reasoning": 10,
      "code": 10,
      "math": 10,
      "research": 10,
      "tools": 9,
      "agentic": 9,
      "instructions": 10,
      "reliability": 9,
      "factuality": 9,
      "speed": 2,
      "multilingual": 9
    },
    "unknown_family": {
      "general": 5,
      "reasoning": 5,
      "code": 5,
      "math": 5,
      "research": 5,
      "tools": 5,
      "agentic": 5,
      "instructions": 5,
      "reliability": 5,
      "factuality": 5,
      "speed": 5,
      "multilingual": 5
    }
  },
  "capability_provenance": {
    "kind": "editorial_seed",
    "confidence": "low",
    "sample_count": 0,
    "warning": "Initial 0-10 scores are routing priors inferred from the supplied descriptions, not benchmark facts. Observed results must be stored separately."
  },
  "model_id_provenance": {
    "qwen-3-5-flash": {"exact_model_id": "qwen3.5-flash", "confidence": "official_verified", "source": "https://www.alibabacloud.com/help/en/model-studio/model-pricing", "verified_on": "2026-09-05"},
    "qwen-3-8-flash": {"exact_model_id": "qwen3.8-flash", "confidence": "official_verified", "source": "https://www.alibabacloud.com/help/en/model-studio/qwen-api-via-openai-responses", "verified_on": "2026-09-05"},
    "qwen-3-5-plus": {"exact_model_id": "qwen3.5-plus", "confidence": "official_verified", "source": "https://www.alibabacloud.com/help/en/model-studio/model-pricing", "verified_on": "2026-09-05"},
    "qwen3-32b": {"exact_model_id": "qwen3-32b", "confidence": "official_verified", "source": "https://www.alibabacloud.com/help/en/model-studio/model-pricing", "verified_on": "2026-09-05"},
    "qwen3-30b-a3b-instruct": {"exact_model_id": "qwen3-30b-a3b-instruct-2507", "confidence": "official_verified", "source": "https://www.alibabacloud.com/help/en/model-studio/model-pricing", "verified_on": "2026-09-05"},
    "qwen3-next-80b-a3b-instruct": {"exact_model_id": "qwen3-next-80b-a3b-instruct", "confidence": "official_verified", "source": "https://www.alibabacloud.com/help/en/model-studio/model-pricing", "verified_on": "2026-09-05"},
    "qwen3-next-80b-a3b-thinking": {"exact_model_id": "qwen3-next-80b-a3b-thinking", "confidence": "official_verified", "source": "https://www.alibabacloud.com/help/en/model-studio/model-pricing", "verified_on": "2026-09-05"},
    "qwen3-235b-a22b-instruct": {"exact_model_id": "qwen3-235b-a22b-instruct-2507", "confidence": "official_verified", "source": "https://www.alibabacloud.com/help/en/model-studio/model-pricing", "verified_on": "2026-09-05"},
    "qwen3-coder-next": {"exact_model_id": "qwen3-coder-next", "confidence": "official_verified", "source": "https://www.alibabacloud.com/help/en/model-studio/model-pricing", "verified_on": "2026-09-05"},
    "qwen-3-6-plus": {"exact_model_id": "qwen3.6-plus", "confidence": "official_verified", "source": "https://www.alibabacloud.com/help/en/model-studio/model-pricing", "verified_on": "2026-09-05"},
    "qwen3-30b-a3b-thinking": {"exact_model_id": "qwen3-30b-a3b-thinking-2507", "confidence": "official_verified", "source": "https://www.alibabacloud.com/help/en/model-studio/model-pricing", "verified_on": "2026-09-05"},
    "qwen3-235b-a22b-thinking": {"exact_model_id": "qwen3-235b-a22b-thinking-2507", "confidence": "official_verified", "source": "https://www.alibabacloud.com/help/en/model-studio/model-pricing", "verified_on": "2026-09-05"},
    "qwen3-coder-30b-a3b-instruct": {"exact_model_id": "qwen3-coder-30b-a3b-instruct", "confidence": "official_verified", "source": "https://www.alibabacloud.com/help/en/model-studio/model-pricing", "verified_on": "2026-09-05"},
    "qwen-3-7-max": {"exact_model_id": "qwen3.7-max", "confidence": "official_verified", "source": "https://www.alibabacloud.com/help/en/model-studio/model-pricing", "verified_on": "2026-09-05"},
    "qwen3-coder-480b-a35b-instruct": {"exact_model_id": "qwen3-coder-480b-a35b-instruct", "confidence": "official_verified", "source": "https://www.alibabacloud.com/help/en/model-studio/model-pricing", "verified_on": "2026-09-05"},
    "glm-4-7-flashx": {"exact_model_id": "glm-4.7-flashx", "confidence": "official_verified", "source": "https://docs.z.ai/api-reference/llm/chat-completion", "verified_on": "2026-09-05"},